ticker,company_name,province,hq_address_raw,soe_dummy_final,state_own_share
HHS,Công ty Cổ phần Đầu tư Dịch vụ Hoàng Huy,Hải Phòng,"\u003c/b\u003e 116 Nguyễn Đức Cảnh, Phường An Biên, Quận Lê Chân, Thành phố Hải Phòng\u003c/p\u003e\u003cp\u003e\u003cb\u003eĐiện thoại:\u003c/b\u003e 0225 3854626 - Fax: 0225 3782326\u003c/p\u003e\u003cp\u003e\u003cb\u003eNgười công bố thông tin:\u0",0,
HII,Công ty Cổ phần An Tiến Industries,Lào Cai,"\u003c/b\u003e Khu công nghiệp phía Nam, phường Văn Phú, tỉnh Lào Cai\u003c/p\u003e\u003cp\u003e\u003cb\u003eĐiện thoại:\u003c/b\u003e +84 (0216) 3853 886 - Fax: +84 (0216) 3851 123\u003c/p\u003e\u003cp\u003e\u003cb\u003eNgười công bố thông tin:\u003",0,
HLC,Công ty cổ phần Than Hà Lầm - Vinacomin,Quảng Ninh,"\u003c/b\u003e Số 1, phố Tân Lập, phường Hà Lầm, T.P Hạ Long, tỉnh Quảng Ninh\u003c/p\u003e\u003cp\u003e\u003cb\u003eĐiện thoại:\u003c/b\u003e 84-(33) 382 53 39 Fax: 84-(33) 382 12 03\u003c/p\u003e\u003cp\u003e\u003cb\u003eNgười công bố thông tin:\",0,
HMC,Công ty Cổ phần Kim khí Thành phố Hồ Chí Minh - Vnsteel,Hồ Chí Minh,"\u003c/b\u003e Số 193 Đinh Tiên Hoàng, phường Tân Định, T.P Hồ Chí Minh\u003c/p\u003e\u003cp\u003e\u003cb\u003eĐiện thoại:\u003c/b\u003e 028 38294623 Số fax 028 38290403\u003c/p\u003e\u003cp\u003e\u003cb\u003eNgười công bố thông tin:\u003c/b\u00",0,
HMH,Công ty Cổ phần Hải Minh,Hồ Chí Minh,"\u003c/b\u003e Tầng 17, Tòa nhà Pearl Plaza, 561A Điện Biên Phủ, phường Thạnh Mỹ Tây, T.P Hồ Chí Minh\u003c/p\u003e\u003cp\u003e\u003cb\u003eĐiện thoại:\u003c/b\u003e (08) 35.128.668 - Fax: 35.128.688\u003c/p\u003e\u003cp\u003e\u003cb\u003eNgười công",0,
HOM,Công ty cổ phần Xi măng VICEM Hoàng Mai,Nghệ An,"\u003c/b\u003e Khối 7, phường Quỳnh Thiện, thị xã Hoàng Mai,tỉnh Nghệ An\u003c/p\u003e\u003cp\u003e\u003cb\u003eĐiện thoại:\u003c/b\u003e (84-38) 3 866 170 – Fax: (84-38) 3 866 648\u003c/p\u003e\u003cp\u003e\u003cb\u003eNgười công bố thông tin:\u003c",0,
HPX,Công ty cổ phần Đầu tư Hải Phát,Hà Nội,"\u003c/b\u003e Tầng 5, Toà CT3, The Pride, Khu ĐTM An Hưng, phường Hà Đông, Hà Nội\u003c/p\u003e\u003cp\u003e\u003cb\u003eĐiện thoại:\u003c/b\u003e +84-24-32.080.666 - Fax +84-24-32.080.566\u003c/p\u003e\u003cp\u003e\u003cb\u003eNgười công bố thông t",0,
HQC,Công ty cổ phần Tư vấn-Thương mại-Dịch vụ Địa ốc Hoàng Quân,Hồ Chí Minh,"\u003c/b\u003e 286-288 Huỳnh Văn Bách, Phường 11, quận Phú Nhuận, TP. Hồ Chí Minh\u003c/p\u003e\u003cp\u003e\u003cb\u003eĐiện thoại:\u003c/b\u003e +84-(08) 6292 8617 - Fax: +84-(08) 6292 8486\u003c/p\u003e\u003cp\u003e\u003cb\u003eNgười công bố thôn",0,
HSG,Công ty Cổ phần Tập đoàn Hoa Sen,Hồ Chí Minh,"\u003c/b\u003e Số 9 Đại Lộ Thống Nhất, KCN Sóng Thần II, Phường Dĩ An, TP Hồ Chí Minh\u003c/p\u003e\u003cp\u003e\u003cb\u003eĐiện thoại:\u003c/b\u003e 0274 379 09 55 ; Fax: 0274 379 08 88\u003c/p\u003e\u003cp\u003e\u003cb\u003eNgười công bố thông ti",0,
HT1,Công ty Cổ phần xi măng VICEM Hà Tiên,Hồ Chí Minh,"\u003c/b\u003e 604 Võ Văn Kiệt, Phường Cầu Ông Lãnh, Thành phố HCM\u003c/p\u003e\u003cp\u003e\u003cb\u003eĐiện thoại:\u003c/b\u003e 84-(28) 383 683 63 Fax: 84-(28) 383 612 78\u003c/p\u003e\u003cp\u003e\u003cb\u003eNgười công bố thông tin:\u003c/b\",0,
HTC,Công ty Cổ phần Thương mại Hóc Môn,Hồ Chí Minh,"\u003c/b\u003e 25 Bà Triệu, khu phố 1, xã Hóc Môn, T.P Hồ Chí Minh\u003c/p\u003e\u003cp\u003e\u003cb\u003eĐiện thoại:\u003c/b\u003e 84-(8) 38 915 294 Fax: 84-(8) 38 910 457\u003c/p\u003e\u003cp\u003e\u003cb\u003eNgười công bố thông tin:\u003c/b\",0,
HTG,Tổng Công ty cổ phần Dệt may Hòa Thọ,Đà Nẵng,"\u003c/b\u003e 36 Ông Ích Đường, phường Cẩm Lệ, T.P Đà Nẵng\u003c/p\u003e\u003cp\u003e\u003cb\u003eĐiện thoại:\u003c/b\u003e 0236.3846290 Fax : 0236.3846216\u003c/p\u003e\u003cp\u003e\u003cb\u003eNgười công bố thông tin:\u003c/b\u003e \u003c/p\u003e\",0,
HTI,Công ty Cổ phần Đầu tư phát triển hạ tầng IDICO,Hồ Chí Minh,"\u003c/b\u003e Km 1906+700 Quốc lộ 1A, KP5, P.Bình Hưng Hòa B, Q.Bình Tân, TP Hồ Chí Minh.\u003c/p\u003e\u003cp\u003e\u003cb\u003eĐiện thoại:\u003c/b\u003e 028 3750 3042 Fax: 028 3750 2825\u003c/p\u003e\u003cp\u003e\u003cb\u003eNgười công bố thô",0,
HTL,Công ty Cổ phần Kỹ thuật và Ô tô Trường Long,Hồ Chí Minh,"\u003c/b\u003e Lô 46, đường số 3, KCN Tân Tạo, phường Tân Tạo, TP HCM\u003c/p\u003e\u003cp\u003e\u003cb\u003eĐiện thoại:\u003c/b\u003e 028 3754 3188 Fax: 028 3754 3189\u003c/p\u003e\u003cp\u003e\u003cb\u003eNgười công bố thông tin:\u003c/b\u003e \u00",0,
HUB,Công ty cổ phần Xây lắp Thừa Thiên Huế,Hà Nội,"\u003c/b\u003e Số 72 đường Phạm Văn Đồng, Phường Vỹ Dạ, quận Thuận Hóa, TP Huế, Hà Nội.\u003c/p\u003e\u003cp\u003e\u003cb\u003eĐiện thoại:\u003c/b\u003e (0234) 3821510 - 3849390 - 3849472 Fax: (0234) 3\u003c/p\u003e\u003cp\u003e\u003cb\u003eNgười c",0,
HVH,Công ty Cổ phần Đầu tư và Công nghệ HVC,Hà Nội,"\u003c/b\u003e Tầng 8, tòa tháp C - Hồ Gươm plaza, số 102 Trần Phú, phường Mộ Lao, quận Hà Đông, T.P Hà Nội\u003c/p\u003e\u003cp\u003e\u003cb\u003eĐiện thoại:\u003c/b\u003e (84-24) 3540 2246 Fax: (84-24) 3540 2247\u003c/p\u003e\u003cp\u003e\u003cb",0,
HVT,Công ty Cổ phần Hóa chất Việt Trì,Phú Thọ,"\u003c/b\u003e phố Sông Thao, phường Thanh Miếu, tỉnh Phú Thọ\u003c/p\u003e\u003cp\u003e\u003cb\u003eĐiện thoại:\u003c/b\u003e 84-(210) 391 3743 Fax: 84–(210) 391 15 12\u003c/p\u003e\u003cp\u003e\u003cb\u003eNgười công bố thông tin:\u003c/b\u003e \",0,
HVX,Công ty Cổ phần Xi măng Vicem Hải Vân,Đà Nẵng,"\u003c/b\u003e 65 Nguyễn Văn Cừ, Quận Liên Chiểu, TP Đà Nẵng\u003c/p\u003e\u003cp\u003e\u003cb\u003eĐiện thoại:\u003c/b\u003e 84-(511) 384 21 72/529 Fax: 84-(511) 384 24 41\u003c/p\u003e\u003cp\u003e\u003cb\u003eNgười công bố thông tin:\u003c/b\u0",0,
ICG,Công ty Cổ phần Xây dựng Sông Hồng,Hà Nội,"\u003c/b\u003e 164 Lò Đúc, phường Hai Bà Trưng, T.P Hà Nội\u003c/p\u003e\u003cp\u003e\u003cb\u003eĐiện thoại:\u003c/b\u003e 84-4 397 272 96 Fax: 84-4 397 272 95\u003c/p\u003e\u003cp\u003e\u003cb\u003eNgười công bố thông tin:\u003c/b\u003e \u003c/p",0,
ICT,Công ty cổ phần Viễn thông - Tin học Bưu điện,Hà Nội,"\u003c/b\u003e Ngõ 158/2 Phố Hồng Mai, Phường Quỳnh Lôi, Quận Hai Bà Trưng, Thành phố Hà Nội, Việt Nam\u003c/p\u003e\u003cp\u003e\u003cb\u003eĐiện thoại:\u003c/b\u003e +84-4-38634597 / Fax: +84-4-38632061\u003c/p\u003e\u003cp\u003e\u003cb\u003eNgười",0,
IDC,Tổng công ty IDICO - Công ty Cổ phần,Hồ Chí Minh,"\u003c/b\u003e 151A Nguyễn Đình Chiểu, phường Xuân Hòa, T.P Hồ Chí Minh\u003c/p\u003e\u003cp\u003e\u003cb\u003eĐiện thoại:\u003c/b\u003e 028 38438883 Fax 028 39312705\u003c/p\u003e\u003cp\u003e\u003cb\u003eNgười công bố thông tin:\u003c/b\u003e \u003",0,
IDI,Công ty Cổ phần Đầu tư và Phát triển Đa Quốc Gia I.D.I,Đồng Tháp,"\u003c/b\u003e Quốc lộ 80, Cụm công nghiệp Vàm Cống, ấp An Thạnh, xã Lấp Vò, tỉnh Đồng Tháp\u003c/p\u003e\u003cp\u003e\u003cb\u003eĐiện thoại:\u003c/b\u003e 84-(67) 3680 383 / 296 800 Fax: 84-(67) 3680 382\u003c/p\u003e\u003cp\u003e\u003cb\u003eNgư",0,
IMP,Công ty Cổ phần Dược phẩm IMEXPHARM,Đồng Tháp,"\u003c/b\u003e Số 4, Đường 30/4, Phường Cao Lãnh, Tỉnh Đồng Tháp\u003c/p\u003e\u003cp\u003e\u003cb\u003eĐiện thoại:\u003c/b\u003e 84-(67) 385 19 41 Fax: 84-(67) 385 31 06\u003c/p\u003e\u003cp\u003e\u003cb\u003eNgười công bố thông tin:\u003c/b\u003e",0,
INN,Công ty Cổ phần Bao bì và In Nông nghiệp,Hà Nội,"\u003c/b\u003e 72 Trường Chinh, P.Kim Liên, T.P Hà Nội\u003c/p\u003e\u003cp\u003e\u003cb\u003eĐiện thoại:\u003c/b\u003e 84-(4) 368 400 95 Fax: 84-(4) 368 400 95\u003c/p\u003e\u003cp\u003e\u003cb\u003eNgười công bố thông tin:\u003c/b\u003e \u003c/p\",0,
ITD,Công ty Cổ phần Công nghệ ITD,Hồ Chí Minh,"\u003c/b\u003e Lầu 4, Tòa nhà ITD, Số 01 đường Sáng Tạo, phường Tân Thuận, TP Hồ Chí Minh, Việt Nam\u003c/p\u003e\u003cp\u003e\u003cb\u003eĐiện thoại:\u003c/b\u003e 028.37701114 Fax: 028.37701116\u003c/p\u003e\u003cp\u003e\u003cb\u003eNgười công bố t",0,
KBC,Tổng Công ty Phát triển Đô thị Kinh Bắc-CTCP,Bắc Ninh,"\u003c/b\u003e Lô 7B, Khu Công nghiệp Quế Võ, phường Phương Liễu, tỉnh Bắc Ninh\u003c/p\u003e\u003cp\u003e\u003cb\u003eĐiện thoại:\u003c/b\u003e 0241 3634 034 Fax: 0241 3634 035\u003c/p\u003e\u003cp\u003e\u003cb\u003eNgười công bố thông tin:\u003c/",0,
KDH,Công ty Cổ phần Đầu tư và Kinh doanh nhà Khang Điền,Hồ Chí Minh,"\u003c/b\u003e Phòng 1 và 2 lầu 11, Sài Gòn Centre, 67 Lê Lợi, phường Sài Gòn, Thành phố Hồ Chí Minh\u003c/p\u003e\u003cp\u003e\u003cb\u003eĐiện thoại:\u003c/b\u003e +84-(08)-3820 8858 - Fax: +84-(08)-3820 8859\u003c/p\u003e\u003cp\u003e\u003cb\u003e",0,
KHG,Công ty Cổ phần Tập đoàn Khải Hoàn Land,Hồ Chí Minh,"\u003c/b\u003e R4-93 Đường Hưng Gia 4, KĐT Phú Mỹ Hưng, phường Tân Hưng, T.P Hồ Chí Minh\u003c/p\u003e\u003cp\u003e\u003cb\u003eĐiện thoại:\u003c/b\u003e (028) 5411 0088\u003c/p\u003e\u003cp\u003e\u003cb\u003eNgười công bố thông tin:\u003c/b\u003e \u",0,
KHP,Công ty Cổ phần Điện lực Khánh Hòa,Khánh Hòa,"\u003c/b\u003e 11 Lý Thánh Tôn, Phường Nha Trang, tỉnh Khánh Hòa\u003c/p\u003e\u003cp\u003e\u003cb\u003eĐiện thoại:\u003c/b\u003e (84-58) 222 0220 Fax: (84-58) 382 3828\u003c/p\u003e\u003cp\u003e\u003cb\u003eNgười công bố thông tin:\u003c/b\u003e \",0,
KMT,Công ty cổ phần Kim khí miền Trung,Đà Nẵng,"\u003c/b\u003e 69 Quang Trung, Quận Hải Châu - TP Đà Nẵng\u003c/p\u003e\u003cp\u003e\u003cb\u003eĐiện thoại:\u003c/b\u003e 84-(511) 382 1824 - Fax: 84-(511) 382 33 06\u003c/p\u003e\u003cp\u003e\u003cb\u003eNgười công bố thông tin:\u003c/b\u003e Bà Ng",0,
KSB,Công ty Cổ phần Khoáng sản và Xây dựng Bình Dương,Bình Dương,"\u003c/b\u003e Đại lộ Bình Dương, Khu phố Hòa Lân 1, P.Thuận An, thị xã Thuận An, tỉnh Bình Dương\u003c/p\u003e\u003cp\u003e\u003cb\u003eĐiện thoại:\u003c/b\u003e 84-(650) 382 26 02 Fax: 84-(650) 382 39 22\u003c/p\u003e\u003cp\u003e\u003cb\u003eNgư",1,0.5005
KSF,Công ty Cổ phần Tập đoàn Sunshine,Hà Nội,"\u003c/b\u003e Tầng 12, tòa nhà Sunshine Center, 16 Phạm Hùng, phường Từ Liêm, T.P Hà Nội\u003c/p\u003e\u003cp\u003e\u003cb\u003eĐiện thoại:\u003c/b\u003e +84-(024)-7305.2999\u003c/p\u003e\u003cp\u003e\u003cb\u003eNgười công bố thông tin:\u003c/b\u00",0,
KST,Công ty cổ phần KASATI,Hồ Chí Minh,"\u003c/b\u003e 270A Lý Thường Kiệt, phường 14, quận 10, T.P Hồ Chí Minh\u003c/p\u003e\u003cp\u003e\u003cb\u003eĐiện thoại:\u003c/b\u003e +84-(08) 3865 5343 - Fax: +84-(08) 3865 2487\u003c/p\u003e\u003cp\u003e\u003cb\u003eNgười công bố thông tin:\u003",0,
KSV,Tổng Công ty Khoáng sản TKV - CTCP,Hà Nội,"\u003c/b\u003e Số 193 đường Nguyễn Huy Tưởng, phường Thanh Xuân Trung, quận Thanh Xuân, Hà Nội\u003c/p\u003e\u003cp\u003e\u003cb\u003eĐiện thoại:\u003c/b\u003e (024) 6287.6666 – Fax: (024) 6288.3333\u003c/p\u003e\u003cp\u003e\u003cb\u003eNgười công b",0,
L14,Công ty cổ phần LICOGI 14,Phú Thọ,"\u003c/b\u003e Số 2068, đại lộ Hùng Vương, P. Nông Trang, T.P Việt Trì, tỉnh Phú Thọ\u003c/p\u003e\u003cp\u003e\u003cb\u003eĐiện thoại:\u003c/b\u003e +84-(02103) 953 543 - Fax: +84-(02103) 953 542\u003c/p\u003e\u003cp\u003e\u003cb\u003eNgười công",0,
L40,Công ty Cổ phần Đầu tư và Xây dựng 40,Hồ Chí Minh,"\u003c/b\u003e 201/58 Nguyễn Xí, phường Bình Thạnh, T.P Hồ Chí Minh\u003c/p\u003e\u003cp\u003e\u003cb\u003eĐiện thoại:\u003c/b\u003e (84-8)3899 0099 Fax: (84-8)3511 7533\u003c/p\u003e\u003cp\u003e\u003cb\u003eNgười công bố thông tin:\u003c/b\u003e",0,
LAF,Công ty Cổ phần Chế biến Hàng xuất khẩu Long An,Tây Ninh,"\u003c/b\u003e Số 81B, quốc lộ 62, phường Long An, tỉnh Tây Ninh\u003c/p\u003e\u003cp\u003e\u003cb\u003eĐiện thoại:\u003c/b\u003e 84-(72) 3821 501 - Fax: 84-(72) 3826 735\u003c/p\u003e\u003cp\u003e\u003cb\u003eNgười công bố thông tin:\u003c/b\u003e \",0,
LAS,Công ty cổ phần Supe Phốt phát và Hóa chất Lâm Thao,Phú Thọ,"\u003c/b\u003e Khu Phương Lai 6, Thị trấn Lâm Thao, Huyện Lâm Thao, Tỉnh Phú Thọ\u003c/p\u003e\u003cp\u003e\u003cb\u003eĐiện thoại:\u003c/b\u003e +84-(0210) 3825 139 - Fax: +84-(0210) 3825 126\u003c/p\u003e\u003cp\u003e\u003cb\u003eNgười công bố thôn",0,
LBE,Công ty cổ phần Thương mại và Dịch vụ LVA,Hà Nội,"\u003c/b\u003e 121 Bà Triệu, phường Nguyễn Du, quận Hai Bà Trưng, T.P Hà Nội\u003c/p\u003e\u003cp\u003e\u003cb\u003eĐiện thoại:\u003c/b\u003e 84-(72) 3822 374 Fax: 84-(72) 3834 447\u003c/p\u003e\u003cp\u003e\u003cb\u003eNgười công bố thông tin:\u00",0,
LDG,Công ty Cổ phần Đầu tư LDG,Đồng Nai,"\u003c/b\u003e Lô E9, đường D2, Khu Dân cư - Dịch vụ Giang Điền (Khu A), xã Trảng Bom, Tỉnh Đồng Nai\u003c/p\u003e\u003cp\u003e\u003cb\u003eĐiện thoại:\u003c/b\u003e (0251) 896 6666Fax: (0251) 896 6668\u003c/p\u003e\u003cp\u003e\u003cb\u003eNgười côn",0,
LDP,Công ty Cổ phần Dược Lâm Đồng - Ladophar,Lâm Đồng,"\u003c/b\u003e 18 Ngô Quyền, phường Cam Ly-Đà Lạt, tỉnh Lâm Đồng\u003c/p\u003e\u003cp\u003e\u003cb\u003eĐiện thoại:\u003c/b\u003e 84-(63) 382 12 28 - Fax: 84-(63) 382 23 69\u003c/p\u003e\u003cp\u003e\u003cb\u003eNgười công bố thông tin:\u003c/b\u003e",0,
LGL,Công ty cổ phần Đầu tư và Phát triển Đô thị Long Giang,Hà Nội,"\u003c/b\u003e Tầng 25, tháp A, toà nhà 173 Xuân Thuỷ - Quận Cầu Giấy - Hà Nội\u003c/p\u003e\u003cp\u003e\u003cb\u003eĐiện thoại:\u003c/b\u003e (84-024) 3795 0595/96/97/98/99 Fax: (84-024) 3795\u003c/p\u003e\u003cp\u003e\u003cb\u003eNgười công bố th",0,
LHC,Công ty Cổ phần Đầu tư và Xây dựng Thủy lợi Lâm Đồng,Lâm Đồng,"\u003c/b\u003e 87 Phù Đổng Thiên Vương, phường Lâm Viên-Đà Lạt, tỉnh Lâm Đồng\u003c/p\u003e\u003cp\u003e\u003cb\u003eĐiện thoại:\u003c/b\u003e 84-(63) 3821854 Fax:84-(63) 383 25 42\u003c/p\u003e\u003cp\u003e\u003cb\u003eNgười công bố thông tin:\u",0,
LHG,Công ty Cổ phần Long Hậu,Tây Ninh,"\u003c/b\u003e Ấp Long Hậu 3, xã Cần Giuộc, tỉnh Tây Ninh\u003c/p\u003e\u003cp\u003e\u003cb\u003eĐiện thoại:\u003c/b\u003e 84-(8) 378 189 29 Fax: 84-(8) 378 189 40\u003c/p\u003e\u003cp\u003e\u003cb\u003eNgười công bố thông tin:\u003c/b\u003e \u003",0,
LIG,Công ty Cổ phần Licogi 13,Hà Nội,"\u003c/b\u003e Tầng 4, tòa nhà LICOGI 13, đường Khuất Duy Tiến, P. Nhân Chính, Q. Thanh Xuân, T.P Hà Nội\u003c/p\u003e\u003cp\u003e\u003cb\u003eĐiện thoại:\u003c/b\u003e +84-(04)-3854 4623 - Fax: +84-(04)-3854 4107\u003c/p\u003e\u003cp\u003e\u003cb\u",0,
LIX,Công ty Cổ phần Bột giặt Lix,Hồ Chí Minh,"\u003c/b\u003e Số 3, đường số 2, Khu phố 28, P.Linh Xuân,Tp.HCM\u003c/p\u003e\u003cp\u003e\u003cb\u003eĐiện thoại:\u003c/b\u003e 84-(8) 3896 6803 Fax: 84-(8) 3896 7522\u003c/p\u003e\u003cp\u003e\u003cb\u003eNgười công bố thông tin:\u003c/b\u003e \u0",1,0.77
LM8,Công ty Cổ phần Lilama 18,Hồ Chí Minh,"\u003c/b\u003e Sô 9-19 Hồ Tùng Mậu, Phường Sài Gòn, Tp.HCM\u003c/p\u003e\u003cp\u003e\u003cb\u003eĐiện thoại:\u003c/b\u003e 84-(8) 382 984 90 Fax: 84-(8) 382 108 53\u003c/p\u003e\u003cp\u003e\u003cb\u003eNgười công bố thông tin:\u003c/b\u003e \u003",0,
LPB,Ngân hàng Thương mại cổ phần Lộc Phát Việt Nam,Hà Nội,"\u003c/b\u003e LPB Tower, số 210 Trần Quang Khải, Phường Hoàn Kiếm, TP Hà Nội\u003c/p\u003e\u003cp\u003e\u003cb\u003eĐiện thoại:\u003c/b\u003e 024 62 668 668 - Fax: 024 62 669 669\u003c/p\u003e\u003cp\u003e\u003cb\u003eNgười công bố thông tin:\u003c/",0,
LSS,Công ty Cổ phần Mía đường Lam Sơn,Thanh Hóa,"\u003c/b\u003e Thị trấn Lam Sơn, huyện Thọ Xuân, tỉnh Thanh Hóa\u003c/p\u003e\u003cp\u003e\u003cb\u003eĐiện thoại:\u003c/b\u003e 0373.8 996.667 Fax: 0373.8 996.667\u003c/p\u003e\u003cp\u003e\u003cb\u003eNgười công bố thông tin:\u003c/b\u003e \u003c",0,
MAC,Công ty cổ phần Tập đoàn MacStar,Hải Phòng,"\u003c/b\u003e Số 8A đường vòng Vạn Mỹ, Ngô Quyền, Hải Phòng, Việt Nam\u003c/p\u003e\u003cp\u003e\u003cb\u003eĐiện thoại:\u003c/b\u003e 84-(31) 3 766 561 Fax: 84-(31) 3 765 771\u003c/p\u003e\u003cp\u003e\u003cb\u003eNgười công bố thông tin:\u003c/b",0,
MAS,Công ty cổ phần Dịch vụ Hàng không Sân bay Đà Nẵng,Đà Nẵng,"\u003c/b\u003e Sân Bay Quốc Tế Đà Nẵng, Quận Hải Châu, TP Đà Nẵng\u003c/p\u003e\u003cp\u003e\u003cb\u003eĐiện thoại:\u003c/b\u003e 84-(511) 382 66 80 - Fax: 84-(511) 382 61 33\u003c/p\u003e\u003cp\u003e\u003cb\u003eNgười công bố thông tin:\u003c/b\u0",0,
MBG,Công ty cổ phần Tập đoàn MBG,Hà Nội,"\u003c/b\u003e Số nhà 1B, ngõ 880 đường Bạch Đằng, P. Thanh Lương, Q. Hai Bà Trưng, T.P Hà Nội\u003c/p\u003e\u003cp\u003e\u003cb\u003eĐiện thoại:\u003c/b\u003e (04) 3644 7655 - Fax: (04) 3644 7655\u003c/p\u003e\u003cp\u003e\u003cb\u003eNgười công bố",0,
MBS,Công ty cổ phần Chứng khoán MB,Hà Nội,"\u003c/b\u003e Tầng 7+8, tòa nhà MB, 21 Cát Linh, phường Ô Chợ Dừa, T.P Hà Nội\u003c/p\u003e\u003cp\u003e\u003cb\u003eĐiện thoại:\u003c/b\u003e +84-(04)-3726 2600 - Fax: +84-(04)-3726 2601\u003c/p\u003e\u003cp\u003e\u003cb\u003eNgười công bố thông ti",0,
MCC,Công ty Cổ phần Gạch ngói cao cấp,Bình Dương,"\u003c/b\u003e 246 Cây Chàm, phường Thạnh Phước, T.P Tân Uyên, tỉnh Bình Dương\u003c/p\u003e\u003cp\u003e\u003cb\u003eĐiện thoại:\u003c/b\u003e 84-(650) 365 82 78 Fax: 84-(650) 362 53 79\u003c/p\u003e\u003cp\u003e\u003cb\u003eNgười công bố thông ti",0,
MCM,Công ty cổ phần Giống bò sữa Mộc Châu,Sơn La,"\u003c/b\u003e Số 912 đường Thảo Nguyên, phường Thảo Nguyên, Tỉnh Sơn La\u003c/p\u003e\u003cp\u003e\u003cb\u003eĐiện thoại:\u003c/b\u003e (+84-21) 2386 6065 - (+84-21) 2386 9848 Fax: (+84\u003c/p\u003e\u003cp\u003e\u003cb\u003eNgười công bố thông tin",0,
MCO,Công ty Cổ phần Đầu tư và Xây dựng BDC Việt Nam,Hà Nội,"\u003c/b\u003e Số 8, ngõ 121 Thái Hà, Quận Đống Đa, Hà Nội.\u003c/p\u003e\u003cp\u003e\u003cb\u003eĐiện thoại:\u003c/b\u003e 84-(4) 3 537 32 41 | Fax: 84-(4) 3 537 32 40\u003c/p\u003e\u003cp\u003e\u003cb\u003eNgười công bố thông tin:\u003c/b\u003e Ô",0,
MDC,Công ty cổ phần Than Mông Dương - Vinacomin,Quảng Ninh,"\u003c/b\u003e Tổ 7, khu 3, phường Mông Dương, tỉnh Quảng Ninh\u003c/p\u003e\u003cp\u003e\u003cb\u003eĐiện thoại:\u003c/b\u003e 84-(33) 386 82 71 - Fax: 84-(33) 386 82 76\u003c/p\u003e\u003cp\u003e\u003cb\u003eNgười công bố thông tin:\u003c/b\u003e \",0,
MDG,Công ty Cổ phần miền Đông,Đồng Nai,"\u003c/b\u003e Đường số 1, KCN Biên Hòa 1, P.An Bình, Tp.Biên Hòa, Tỉnh Đồng Nai\u003c/p\u003e\u003cp\u003e\u003cb\u003eĐiện thoại:\u003c/b\u003e 06 1383 6371 Fax: 061.3836194\u003c/p\u003e\u003cp\u003e\u003cb\u003eNgười công bố thông tin:\u003c/",0,
MED,Công ty cổ phần Dược Trung ương Mediplantex,Hà Nội,"\u003c/b\u003e 358 đường Giải Phóng, Thanh Xuân, Hà Nội\u003c/p\u003e\u003cp\u003e\u003cb\u003eĐiện thoại:\u003c/b\u003e (024) 3864 3360 - Fax: (024) 3864 1584\u003c/p\u003e\u003cp\u003e\u003cb\u003eNgười công bố thông tin:\u003c/b\u003e \u003c/p\u00",0,
MEL,Công ty Cổ phần Thép Mê Lin,Vĩnh Phúc,"\u003c/b\u003e Khu Hành chính số 8, phường Đống Đa, thành phố Vĩnh Yên, tỉnh Vĩnh Phúc\u003c/p\u003e\u003cp\u003e\u003cb\u003eĐiện thoại:\u003c/b\u003e (0211)2479553 Fax : (0211)2479553\u003c/p\u003e\u003cp\u003e\u003cb\u003eNgười công bố thông tin:\",0,
MIG,Tổng Công ty cổ phần Bảo hiểm Quân đội,Hà Nội,"\u003c/b\u003e Tầng 5-6, số 21 Cát Linh, Phường Cát Linh, quận Đống Đa, TP Hà Nội\u003c/p\u003e\u003cp\u003e\u003cb\u003eĐiện thoại:\u003c/b\u003e (024) 62853388 Fax: (024) 62853366\u003c/p\u003e\u003cp\u003e\u003cb\u003eNgười công bố thông tin:\",0,
MKV,Công ty Cổ phần Dược Thú y Cai Lậy,Tiền Giang,"\u003c/b\u003e Khu phố 1, phường 5, thị xã Cai Lậy, tỉnh Tiền Giang\u003c/p\u003e\u003cp\u003e\u003cb\u003eĐiện thoại:\u003c/b\u003e 84-(73) 3 820 974 Fax: 84(73) 3 710 769\u003c/p\u003e\u003cp\u003e\u003cb\u003eNgười công bố thông tin:\u003c/b\u0",0,0.4
MSB,Ngân hàng Thương mại cổ phần Hàng hải Việt Nam,Hà Nội,"\u003c/b\u003e Số 54A Nguyễn Chí Thanh - Phường Láng, T.P Hà Nội\u003c/p\u003e\u003cp\u003e\u003cb\u003eĐiện thoại:\u003c/b\u003e +84-(024) 3771 0981 - Fax: +84-(024) 3771 8899\u003c/p\u003e\u003cp\u003e\u003cb\u003eNgười công bố thông tin:\u003c/b\u",0,
NAB,Ngân hàng Thương mại cổ phần Nam Á,Hồ Chí Minh,"\u003c/b\u003e 201-203 Cách Mạng Tháng Tám, phường 4, quận 3, T.P Hồ Chí Minh\u003c/p\u003e\u003cp\u003e\u003cb\u003eĐiện thoại:\u003c/b\u003e (84-8) 3929 6699 Fax: (84-8) 3929 6688\u003c/p\u003e\u003cp\u003e\u003cb\u003eNgười công bố thông tin:\u0",0,
NAG,Công ty cổ phần Tập đoàn Nagakawa,Vĩnh Phúc,"\u003c/b\u003e Khu 9, Phường Phúc Thắng, Thành phố Phúc yên, Tỉnh Vĩnh Phúc\u003c/p\u003e\u003cp\u003e\u003cb\u003eĐiện thoại:\u003c/b\u003e 02432151329Fax: (84-211) 3 873 569\u003c/p\u003e\u003cp\u003e\u003cb\u003eNgười công bố thông tin:\u003c/b\u0",0,
NAV,Công ty Cổ phần Nam Việt,Hồ Chí Minh,"\u003c/b\u003e 18F Tăng Nhơn Phú, Khu phố 4, Phường Phước Long B, Quận 9, Tp. Hồ Chí Minh. \u003c/p\u003e\u003cp\u003e\u003cb\u003eĐiện thoại:\u003c/b\u003e 84-(8) 3 731 39 91 - Fax: 84-(8) 3 731 36 41\u003c/p\u003e\u003cp\u003e\u003cb\u003eNgười côn",0,0.2
NBC,Công ty cổ phần Than Núi Béo – Vinacomin,Quảng Ninh,"\u003c/b\u003e 799 Lê Thánh Tông, phường Hồng Gai, tỉnh Quảng Ninh\u003c/p\u003e\u003cp\u003e\u003cb\u003eĐiện thoại:\u003c/b\u003e +84-(033)-3825 220 - Fax: +84-(033)-3625 270\u003c/p\u003e\u003cp\u003e\u003cb\u003eNgười công bố thông tin:\u003c/b\u",0,
NBP,Công ty Cổ phần Nhiệt điện Ninh Bình,Ninh Bình,"\u003c/b\u003e 01A Đường Hoàng Diệu, T.P Ninh Bình, tỉnh Ninh Bình\u003c/p\u003e\u003cp\u003e\u003cb\u003eĐiện thoại:\u003c/b\u003e 84-(030) 2210 537 Fax : 84-(030) 3873 762\u003c/p\u003e\u003cp\u003e\u003cb\u003eNgười công bố thông tin:\u003c/b\u00",0,
NBW,Công ty Cổ phần Cấp nước Nhà Bè,Hồ Chí Minh,"\u003c/b\u003e 1179 Nguyễn Văn Linh, khu phố 41, phường Tân Hưng, T.P Hồ Chí Minh\u003c/p\u003e\u003cp\u003e\u003cb\u003eĐiện thoại:\u003c/b\u003e 19001210 Fax: 028.51422500\u003c/p\u003e\u003cp\u003e\u003cb\u003eNgười công bố thông tin:\u003c/b\u0",0,
NCT,Công ty Cổ phần Dịch vụ Hàng hóa Nội Bài,Hà Nội,"\u003c/b\u003e Sân bay Quốc tế Nội Bài, Xã Nội Bài, Thành phố Hà Nội, Việt Nam\u003c/p\u003e\u003cp\u003e\u003cb\u003eĐiện thoại:\u003c/b\u003e (84-24) 35840905 Fax: (84-24) 35840906\u003c/p\u003e\u003cp\u003e\u003cb\u003eNgười công bố thông tin:",0,
NDX,Công ty Cổ phần Xây lắp Phát triển Nhà Đà Nẵng,Đà Nẵng,"\u003c/b\u003e 31 Núi Thành, phường Hòa Thuận Đông, quận Hải Châu, thành phố Đà Nẵng\u003c/p\u003e\u003cp\u003e\u003cb\u003eĐiện thoại:\u003c/b\u003e +84-(0511) 3613 797 Fax +84-(0511) 3613 797 \u003c/p\u003e\u003cp\u003e\u003cb\u003eNgười công bố th",0,
NFC,Công ty Cổ phần Phân lân Ninh Bình,Ninh Bình,"\u003c/b\u003e Thôn Bộ Đầu, phường Nam Hoa Lư, tỉnh Ninh Bình\u003c/p\u003e\u003cp\u003e\u003cb\u003eĐiện thoại:\u003c/b\u003e (030) 3610 024 / 863 - Fax: (030) 3610 013\u003c/p\u003e\u003cp\u003e\u003cb\u003eNgười công bố thông tin:\u003c/b\u003e \u",0,
NHC,Công ty Cổ phần Gạch Ngói Nhị Hiệp,Hồ Chí Minh,"\u003c/b\u003e 34 đường ĐT 743, phường Tân Đông Hiệp, T.P Hồ Chí Minh\u003c/p\u003e\u003cp\u003e\u003cb\u003eĐiện thoại:\u003c/b\u003e 84-(650) 3749 080 Fax: 84-(650) 3749 287\u003c/p\u003e\u003cp\u003e\u003cb\u003eNgười công bố thông tin:\u003c/b\u0",0,
NHH,Công ty Cổ phần Nhựa Hà Nội,Hà Nội,"\u003c/b\u003e Tổ 12, Phường Phúc Lợi, Quận Long Biên, TP Hà Nội\u003c/p\u003e\u003cp\u003e\u003cb\u003eĐiện thoại:\u003c/b\u003e +84 (024) 3875 6885 - Fax: +84 (024) 3875 6885\u003c/p\u003e\u003cp\u003e\u003cb\u003eNgười công bố thông tin:\u003c/b\u",0,
